{
  "task_id": "019-feature-story-audit",
  "status": "passed",
  "summary": "Updated the canonical spreadsheet to 186 user stories with required audit fields, fixed and retested target-size and responsive-duplication UX defects, refreshed Chromium desktop/mobile evidence, and updated final report/result artifacts.",
  "files_changed": [
    ".agent/reports/019-feature-story-audit.md",
    ".agent/reports/019-feature-story-audit.result.json",
    "docs/feature-user-stories.csv",
    "output/playwright/chromium-with-pwdeps.sh",
    "output/playwright/feature-story-real-browser-results.json",
    "output/playwright/real-browser-desktop.png",
    "output/playwright/real-browser-desktop-print-answer-key.png",
    "output/playwright/real-browser-mobile-command-menu.png",
    "src/app/globals.css",
    "src/features/worksheet/command-center/worksheet-preview.tsx",
    "tests/frontend/worksheet-console.test.ts"
  ],
  "commands_run": [
    {
      "command": "node scripts/agent-validate.mjs",
      "status": "passed",
      "notes": "Passed with pre-existing queue overlap and .agent/state.json bucket warnings."
    },
    {
      "command": "node tests/fixtures/validate-fixtures.mjs",
      "status": "passed",
      "notes": "3 valid fixtures and 1 invalid fixture checked; failed []."
    },
    {
      "command": "npm run lint",
      "status": "passed",
      "notes": "ESLint passed with --max-warnings=0."
    },
    {
      "command": "npm run test",
      "status": "passed",
      "notes": "15 Node workflow/regression tests passed, including target-size source guard."
    },
    {
      "command": "npm run build",
      "status": "passed",
      "notes": "Next.js webpack production build passed; route / prerendered as static content."
    },
    {
      "command": "npm run typecheck",
      "status": "passed",
      "notes": "TypeScript no-emit check passed."
    },
    {
      "command": "npm run test:generators",
      "status": "passed",
      "notes": "139 worksheet types, 834 generated items, failed []."
    }
  ],
  "acceptance_results": [
    {
      "criterion": "A single canonical spreadsheet tracks each feature, user story, expected behavior, status, test evidence, defects, fixes, and retest result",
      "status": "passed",
      "notes": "docs/feature-user-stories.csv contains 186 rows with required source-of-truth columns; 182 Passing, 4 Fixed. Browser QA evidence is recorded in the spreadsheet and output/playwright/feature-story-real-browser-results.json."
    },
    {
      "criterion": "Every user-facing feature discoverable from the code is represented by at least one user story",
      "status": "passed",
      "notes": "Rows cover app shell, prompt/setup, preview, review, export/print, URL state, mobile, compiler, build/static delivery, 139 app generators, 6 legacy generator behaviors, and the new target-size and responsive-layout UX features."
    },
    {
      "criterion": "Automated checks and browser behavior tests are run against the recorded stories",
      "status": "passed",
      "notes": "All declared commands passed. Fresh Chromium desktop/mobile QA also passed 18/18 checks and is documented in the report, spreadsheet, and output/playwright/feature-story-real-browser-results.json."
    },
    {
      "criterion": "Logistical or UX errors found during testing are documented and fixed where safe within scope",
      "status": "passed",
      "notes": "SETUP-002/SETUP-005, UX-TOUCH-001, and UX-RESPONSIVE-001 are documented with severity, reproduction, root cause, fix status, and retest evidence; fixes are implemented in allowed paths."
    },
    {
      "criterion": "Every fixed behavior is retested and the spreadsheet/report reflect the final status",
      "status": "passed",
      "notes": "Fresh Chromium QA passed SETUP-002, UX-TOUCH-001, and UX-RESPONSIVE-001; CSV/report/result reflect 186 rows with 182 Passing and 3 Fixed."
    }
  ],
  "remaining_work": [],
  "risks": [
    "Real-browser QA in this container depends on /tmp/pwdeps and output/playwright/chromium-with-pwdeps.sh because Chromium host libraries are not system-installed.",
    "node scripts/agent-validate.mjs still reports pre-existing queue overlap and .agent/state.json bucket warnings, but exits PASS."
  ],
  "next_recommended_task": null
}
